title,originallink,link,description,pubDate
"부여소방서, 청명·한식 대비 특별경계근무 돌입",http://www.chungnamilbo.co.kr/news/articleView.html?idxno=821746,http://www.chungnamilbo.co.kr/news/articleView.html?idxno=821746,"부여소방서, 청명·한식 대비 특별경계근무 돌입 충남 부여소방서는 청명·한식을 맞아 <b>4월</b> 3일부터 6일까지... 김영배 서장은 &quot;봄철은 건조한 <b>날씨</b>와 강한 바람으로 인해 작은 불티라도 대형화재로 이어질 수 있다&quot;며... ","Thu, 03 Apr 2025 09:32:00 +0900"
2025년 <b>4월</b> 3일 항공리포트,https://news.ifm.kr/news/articleView.html?idxno=414197,https://news.ifm.kr/news/articleView.html?idxno=414197,"현재 인천공항은 맑은 <b>날씨</b>를 보이고 있는데요, 눈으로 확인할 수 있는 최대거리는 7000m입니다. 오늘은 서해상에 위치한 고기압의 가장자리에 들면서 대체로 맑겠습니다. 인천의 현재기온은 6.1도 낮 최고기온은 도가... ","Thu, 03 Apr 2025 09:28:00 +0900"
영어 잘하는 전소미 첫 알바 가장 큰 고충=언어의 장벽이었다(길바닥 밥...,https://www.newsen.com/news_view.php?uid=202504030916101910,https://m.entertain.naver.com/article/609/0000971126,걱정 없이 갔는데 장사만 하려고 하면 바람이 불고 난리였다”며 바람이 불어 불 조절이 되지 않는 등 야외 영업에서 예측 불가능한 <b>날씨</b>의 변수로 어려움을 겪었다고 회상했다. ‘길바닥 밥장사’는 <b>4월</b> 8일 첫 방송된다.,"Thu, 03 Apr 2025 09:24:00 +0900"
"&quot;텀블러 사면 발포 세정제 드려요&quot;…써모스, <b>4월</b> 이벤트",https://www.newsis.com/view/NISX20250403_0003124735,https://n.news.naver.com/mnews/article/003/0013160701?sid=101,"써모스코리아 관계자는 &quot;<b>4월</b>은 봄소풍 등 야외활동이 늘어나면서 텀블러 수요가 증가하는 시기인 만큼, 따뜻한 <b>날씨</b> 속에서 위생 관리에 더욱 신경 쓸 수 있도록 보틀 세정제를 증정하고 있다&quot;며 &quot;당사 공식몰 회원이라면... ","Thu, 03 Apr 2025 09:23:00 +0900"
이상근 고성군수 “지역 청년들 창업 지원책 강화하겠다”,https://www.kukinews.com/article/view/kuk202504030032,https://www.kukinews.com/article/view/kuk202504030032,이상근 고성군수는 <b>4월</b>1일 청년창업 활성화를 위해 청년 사업장을 방문하여 청년창업자들을 격려하고... 류해석 부군수는 “최근 고성군 뿐만 아니라 전국적으로 건조한 <b>날씨</b>가 이어지면서 산불 발생 위험이 높아지고... ,"Thu, 03 Apr 2025 09:22:00 +0900"
세븐일레븐 '편커족' 위해 원두커피 할인,https://www.ngetnews.com/news/articleView.html?idxno=523495,https://www.ngetnews.com/news/articleView.html?idxno=523495,뉴스저널리즘 김혜민 기자 = 편의점 세븐일레븐이 따뜻한 봄 <b>날씨</b>와 나들이 시즌을 맞이하여 '편커족'들을... 세븐일레븐에 따르면 지난해 <b>4월</b> 세븐카페 아이스 매출은 전월 대비 40% 신장했고 올해 3월 매출도 전월 대비... ,"Thu, 03 Apr 2025 09:18:00 +0900"
[<b>날씨</b>] <b>4월</b> 3일(목) 대구·경북 낮 12~18도… 건조하고 일교차 커,http://news.lghellovision.net/news/articleView.html?idxno=502238,http://news.lghellovision.net/news/articleView.html?idxno=502238,"- 건조주의보: 대구, 경상북도(영덕, 울진평지, 포항, 경주 제외) - 당분간 대구, 경북내륙은 대기가 매우 건조하겠습니다. - 내일까지 내륙을 중심으로 낮과 밤의 기온차가 15도 내외로 크겠습니다. - 모레 오전부터... ","Thu, 03 Apr 2025 09:08:00 +0900"
"일교차 큰 부여 주간<b>날씨</b>, 외출 전 꼭 챙겨야 할 코디 팁",https://www.tournews21.com/news/articleView.html?idxno=97171,https://www.tournews21.com/news/articleView.html?idxno=97171,"맑은 <b>날씨</b>가 이어지는 <b>4월</b> 6일부터는 부여 궁남지, 정림사지, 부소산성 등 유적지 중심의 야외 명소 방문이 적기다. 벚꽃과 봄꽃이 어우러지는 시기로 역사와 자연을 동시에 즐길 수 있다. 반면, 비 오는 <b>4월</b> 5일과... ","Thu, 03 Apr 2025 09:06:00 +0900"
[추천 낚시터] 2025년 낚시 허용구간 신안 안좌도_대박 꿈꾸며 찾아갔건...,https://fishingseasons.co.kr/fishplace/fishplace_view.asp?b_no=89612&code=n,https://fishingseasons.co.kr/fishplace/fishplace_view.asp?b_no=89612&code=n,"첫 낚시터는 ‘차 대고 3보터’인 산두지<b>날씨</b>가 좋은 때에 맞춰 출조하려고 일기예보를 계속 살폈지만... 국내 최초 사장교와 현수교를 동시에 배치한 교량으로 총연장은 10.8km, 2019년 <b>4월</b> 4일 개통과 동시에 자동차... ","Thu, 03 Apr 2025 09:06:00 +0900"
"일교차 큰 부여 주간<b>날씨</b>, 외출 전 꼭 챙겨야 할 코디 팁",https://www.tournews21.com/news/articleView.html?idxno=97171,https://www.tournews21.com/news/articleView.html?idxno=97171,"맑은 <b>날씨</b>가 이어지는 <b>4월</b> 6일부터는 부여 궁남지, 정림사지, 부소산성 등 유적지 중심의 야외 명소 방문이 적기다. 벚꽃과 봄꽃이 어우러지는 시기로 역사와 자연을 동시에 즐길 수 있다. 반면, 비 오는 <b>4월</b> 5일과... ","Thu, 03 Apr 2025 09:06:00 +0900"
"세븐일레븐, 펀커족 위한 '세븐카페' 이벤트...반값 할인 外",https://www.slist.kr/news/articleView.html?idxno=632220,https://www.slist.kr/news/articleView.html?idxno=632220,편의점 세븐일레븐이 따뜻한 봄 <b>날씨</b>와 나들이 시즌을 맞아 '편커족'을 위한 세븐카페 특별 이벤트를 진행한다. 사진=세븐일레븐 <b>4월</b> 한 달간 오전 7시부터 11시까지 카카오페이머니 결제 시 '세븐카페 ICE 레귤러'를 50... ,"Thu, 03 Apr 2025 09:02:00 +0900"
서브컬처 · 골프 '제이미웨스트' 현대백화점 판교점 팝업 운영,https://www.fashionbiz.co.kr/article/215008,https://www.fashionbiz.co.kr/article/215008,이번 팝업스토어는 <b>4월</b> 4일부터 17일까지 2주간 운영된다. 2025 여름 컬렉션 신상품과 신규 액세서리를 최초... 제이미웨스트 관계자는 &quot;쌀쌀한 <b>날씨</b>가 풀리면서 본격적인 여름 컬렉션을 기다리는 고객들이 많았을 것... ,"Thu, 03 Apr 2025 09:02:00 +0900"
"NH투자 &quot;BGF리테일 1분기 실적 부진했을 듯, 봄철 <b>날씨</b> 추웠던 영향&quot;",https://www.businesspost.co.kr/BP?command=article_view&num=389806,https://www.businesspost.co.kr/BP?command=article_view&num=389806,"주영훈 NH투자증권 연구원은 3일 &quot;비우호적인 <b>날씨</b> 영향으로 1분기 실적은 부진할 것으로 전망한다&quot;며... 다만 식음료 기업들이 원부자재 가격 상승을 근거로 제품 가격 인상을 진행하고 있다는 점, <b>4월</b>부터 추위가... ","Thu, 03 Apr 2025 09:02:00 +0900"
"신세계, 1분기 저점으로 실적 개선",http://www.newsprime.co.kr/news/article.html?no=681742,http://www.newsprime.co.kr/news/article.html?no=681742,"명품 및 가전 카테고리 매출이 양호했으나, 비우호적인 <b>날씨</b> 영향으로 고마진 카테고리에 해당하는 의류... 주영훈 NH투자증권 연구원은 &quot;백화점의 경우 <b>4월</b> 중 명품 특화 매장 ‘더 헤리티지’ 오픈을 통해 명품... ","Thu, 03 Apr 2025 09:00:00 +0900"
"BC카드, <b>4월</b> '봄맞이 특별 할인 이벤트'",http://www.seoulfn.com/news/articleView.html?idxno=553199,http://www.seoulfn.com/news/articleView.html?idxno=553199,"BC카드 정철 상무는 &quot;<b>4월</b> 따뜻한 봄 <b>날씨</b>를 즐기며 가족, 연인, 친구와 함께 즐거운 시간을 보낼 수 있도록 생활업종 위주로 할인 혜택을 준비했다&quot;며 &quot;올해도 BC카드 11개 회원사 고객이 만족할 수 있는 다양한... ","Thu, 03 Apr 2025 09:00:00 +0900"
"NH證 “신세계, 1분기 실적 저점 예상… 목표가 19만원”",https://biz.chosun.com/stock/stock_general/2025/04/03/W5I2GJJYF5BPHMJJIILDVMNDYQ/?utm_source=naver&utm_medium=original&utm_campaign=biz,https://n.news.naver.com/mnews/article/366/0001066245?sid=101,"주영훈 NH투자증권 연구원은 “명품 및 가전 카테고리 매출이 양호했지만, 비우호적인 <b>날씨</b> 영향으로... 주 연구원은 “백화점은 <b>4월</b> 중 명품 특화 매장 ‘더 헤리티지’ 오픈을 통해 명품 경쟁력을 추가로 강화할... ","Thu, 03 Apr 2025 09:00:00 +0900"
"울산소방본부, 청명·한식 맞아 봄철 화재 특별경계근무",http://www.lawissue.co.kr/view.php?ud=2025040308565142199a8c8bf58f_12,http://www.lawissue.co.kr/view.php?ud=2025040308565142199a8c8bf58f_12,울산소방본부는 <b>4월</b> 3일부터 6일까지 4일간 청명(4일)·한식(5일) 등 봄철 화재위험 시기를 맞아 대형화재 예방과 신속한 대응을 위해 전 소방관서가 특별 경계근무를 한다고 밝혔다. 이는 건조한 <b>날씨</b>와 야외활동 증가로... ,"Thu, 03 Apr 2025 09:00:00 +0900"
"에어비앤비, 런트립을 위한 숙소 5선.. &quot;달리기 위해 떠난다&quot;",https://www.discoverynews.kr/news/articleView.html?idxno=1061197,https://www.discoverynews.kr/news/articleView.html?idxno=1061197,"<b>날씨</b>가 따뜻해지며 야외 활동이 활발해지는 가운데, 겨우내 다소 주춤했던 '러닝 열풍'이 특히 젊은 층을... 숙소까지, <b>4월</b> 열리는 전 세계 주요 마라톤 코스 주변의 다양한 에어비앤비 숙소를 소개한다. 군산새만금... ","Thu, 03 Apr 2025 08:52:00 +0900"
"세븐일레븐, '<b>4월</b> 세븐카페&amp;간편식 할인 프로모션' 진행",https://www.megaeconomy.co.kr/news/newsview.php?ncode=1065570477990694,https://www.megaeconomy.co.kr/news/newsview.php?ncode=1065570477990694,편의점 세븐일레븐이 따뜻한 봄 <b>날씨</b>와 나들이 시즌을 맞이하여 ‘편커족’들을 위한 세븐카페 특별... 세븐일레븐에 따르면 지난해 <b>4월</b> 세븐카페 아이스 매출은 전월 대비 40% 신장했고 올해 3월 매출도 전월 대비(2월)... ,"Thu, 03 Apr 2025 08:50:00 +0900"
[전북 <b>날씨</b>]<b>4월</b> 3일 빗방울 떨어져…&quot;일교차 커&quot;,http://news.lghellovision.net/news/articleView.html?idxno=502235,http://news.lghellovision.net/news/articleView.html?idxno=502235,"오늘(3일) 오후부터 저녁 사이 전북 동부에는 0.1mm 미만의 빗방울이 떨어지는 곳이 있겠습니다. 오늘 아침까지 전북내륙 일부 지역에 서리가 내리는 곳이 있겠으니, 농작물 관리 및 개화기 과수 피해에 유의하기... ","Thu, 03 Apr 2025 08:50:00 +0900"
"NH투자증권 &quot;신세계, 하반기 실적 개선 기대…목표가 19만원&quot;",https://www.newsworks.co.kr/news/articleView.html?idxno=790651,https://www.newsworks.co.kr/news/articleView.html?idxno=790651,비우호적인 <b>날씨</b> 영향으로 고마진 카테고리인 의류 판매가 부진했다&quot;며 &quot;면세점은 영업 손실 88억원으로 이전 분기보다는 큰 폭의 적자 축소가 이뤄질 것&quot;이라고 말했다. 그는 &quot;백화점은 <b>4월</b> 중 명품 특화 매장인 '더... ,"Thu, 03 Apr 2025 08:46:00 +0900"
"“<b>날씨</b> 풀리자 아이스커피 매출 쑥” 세븐일레븐, 세븐카페 할인 진행",http://kpenews.com/View.aspx?No=3600902,http://kpenews.com/View.aspx?No=3600902,한국정경신문 서재필 기­자 abceee64@gmail.com [한국정경신문=서재필 기자] 세븐일레븐이 따뜻한 봄 <b>날씨</b>와... 세븐일레븐에 따르면 지난해 <b>4월</b> 세븐카페 아이스 매출은 전월 대비 40% 신장했고 올해 3월 매출도 전월 대비... ,"Thu, 03 Apr 2025 08:46:00 +0900"
"[E-로컬경제] 순천시, 여수시 소식",https://www.ekn.kr/web/view.php?key=20250403022553133,https://www.ekn.kr/web/view.php?key=20250403022553133,"순천=에너지경제신문 권차열 기자 벚꽃이 만개하는 <b>4월</b>의 순천만국가정원에서, 동천 뱃길을 따라 항행하는... 한편, 11월까지 약 8개월 동안 운영될 정원드림호는 <b>날씨</b>의 영향을 크게 받는 배의 특성상 사전 예매는... ","Thu, 03 Apr 2025 08:38:00 +0900"
"&quot;미디어월 그게 뭐죠&quot;…천안시, 삼거리공원 일부사업 '깜깜이' 수의계약",https://www.asiatoday.co.kr/view.php?key=20250403010001634,https://www.asiatoday.co.kr/view.php?key=20250403010001634,"(아시아투데이 <b>4월</b> 2일자 23면 보도)3일 천안시에 따르면 천안 삼거리공원 내 미디어월은 길이 32.4m, 높이 6.... 특히 야외에 설치하는 경우 <b>날씨</b> 변화에 따른 유지보수 비용이 증가할 수 있다는 점도 부담이다.에너지... ","Thu, 03 Apr 2025 08:38:00 +0900"
"NH투자증권 &quot;신세계, 명품 특화 매장 등으로 실적 점차 개선&quot;",http://www.g-enews.com/ko-kr/news/article/news_all/20250403082352716744093b5d4e_1/article.html,http://www.g-enews.com/ko-kr/news/article/news_all/20250403082352716744093b5d4e_1/article.html,"NH투자증권은 3일 신세계에 대해 <b>4월</b> 명품 특화 매장과 면세점 사업 경쟁 완화 등으로 1분기에 점차 실적이... 비우호적인 <b>날씨</b> 영향으로 고마진 카테고리에 해당하는 의류 판매가 부진했다&quot;고 평가했다. 다만, 비용 절감... ","Thu, 03 Apr 2025 08:36:00 +0900"
"세븐일레븐, 세븐카페&amp;간편식 할인 프로모션 진행",http://www.lawissue.co.kr/view.php?ud=202504030834156602204ead0791_12,http://www.lawissue.co.kr/view.php?ud=202504030834156602204ead0791_12,편의점 세븐일레븐(대표 김홍철)이 따뜻한 봄 <b>날씨</b>와 나들이 시즌을 맞이하여 ‘편커족’들을 위한... 지난해 <b>4월</b> 세븐카페 아이스 매출은 전월 대비 40% 신장했고 올해 3월 매출도 전월 대비(2월) 80% 상승하며 편의점... ,"Thu, 03 Apr 2025 08:36:00 +0900"
"세븐일레븐, 아이스 원두커피 <b>4월</b> 한 달간 '50% 할인'",https://www.news1.kr/industry/distribution/5741008,https://n.news.naver.com/mnews/article/421/0008169995?sid=101,"세븐일레븐이 따뜻한 봄 <b>날씨</b>와 나들이 시즌을 맞이해 편의점에서 커피를 구매하는 소비자를 위한... 세븐일레븐에 따르면 지난해 <b>4월</b> 세븐카페 아이스 매출은 전월 대비 40% 신장했고, 올해 3월 매출도 전월 대비 80... ","Thu, 03 Apr 2025 08:33:00 +0900"
"대구·경북 오늘의 <b>날씨</b> (<b>4월</b> 3일)…낮 최고기온 대구·안동 16, 구미 17,...",https://www.yeongnam.com/web/view.php?key=20250403010000288,https://www.yeongnam.com/web/view.php?key=20250403010000288,대구·경북 대체로 흐리다가 차차 맑아짐,"Thu, 03 Apr 2025 08:32:00 +0900"
"마산회원구, 드론으로 불법소각 집중 단속",https://www.newsfreezone.co.kr/news/articleView.html?idxno=618374,https://www.newsfreezone.co.kr/news/articleView.html?idxno=618374,"3월31일부터 <b>4월</b>30일까지 무인항공(드론)을 활용해 관내 12개 읍∙동 농경지 등 불법소각 행위에 대해 집중 단속에 나서고 있다고 밝혔다. 건조한 <b>날씨</b>로 인해 산불 위험이 증가한 만큼, 실화 등 실수로 발생할 수 있는... ","Thu, 03 Apr 2025 08:30:00 +0900"
"신세계, 1분기 실적 저점…하반기 개선 흐름 기대-NH",http://news.mt.co.kr/mtview.php?no=2025040308252442902,https://n.news.naver.com/mnews/article/008/0005175058?sid=101,비우호적인 <b>날씨</b> 영향으로 고마진 카테고리인 의류 판매가 부진했다&quot;며 &quot;면세점은 영업 손실 88억원으로 이전 분기보다는 큰 폭의 적자 축소가 이뤄질 것&quot;이라고 짚었다. 그러면서 &quot;백화점은 <b>4월</b> 중 명품 특화 매장인 '더... ,"Thu, 03 Apr 2025 08:28:00 +0900"
"써모스, 봄나들이 시즌 '고객 감사 특별 이벤트' 실시",http://www.finomy.com/news/articleView.html?idxno=225462,http://www.finomy.com/news/articleView.html?idxno=225462,"써모스코리아 관계자는 &quot;<b>4월</b>은 봄소풍 등 야외활동이 늘어나면서 텀블러 수요가 증가하는 시기인 만큼, 따뜻한 <b>날씨</b> 속에서 위생 관리에 더욱 신경 쓸 수 있도록 보틀 세정제를 증정하고 있다&quot;며 &quot;당사 공식몰 회원이라면... ","Thu, 03 Apr 2025 08:22:00 +0900"
"세븐카페, 봄맞이 아이스커피 매출 폭발…아침엔 반값 모닝커피",https://www.newswhoplus.com/news/articleView.html?idxno=24111,https://www.newswhoplus.com/news/articleView.html?idxno=24111,편의점 세븐일레븐이 따뜻한 봄 <b>날씨</b>와 나들이 시즌을 맞이하여 '편커족'들을 위한 세븐카페 특별 이벤트를... 세븐일레븐에 따르면 지난해 <b>4월</b> 세븐카페 아이스 매출은 전월 대비 40% 신장했고 올해 3월 매출도 전월... ,"Thu, 03 Apr 2025 08:14:00 +0900"
"BGF리테일, 1Q 비수기로 실적 부진-NH",http://www.edaily.co.kr/news/newspath.asp?newsid=01918806642132512,https://n.news.naver.com/mnews/article/018/0005977285?sid=101,"주영훈 연구원은 “동일점 매출은 전년 동기 대비 소폭 하락할 것”이라며 “예상보다 추웠던 봄철 <b>날씨</b>... (객단가), <b>4월</b>부터 추위가 가시며 봄철 행사들이 진행된다는 점(객수)을 고려할 때 매출 비중이 높은 2, 3분기... ","Thu, 03 Apr 2025 08:05:00 +0900"
KIA 조상우 ‘반전의 <b>4월</b>’ 예고,http://www.kwangju.co.kr/article.php?aid=1743634800782139011,http://www.kwangju.co.kr/article.php?aid=1743634800782139011,KIA 타이거즈 조상우가 반전의 <b>4월</b>을 예고했다. ‘디펜딩 챔피언’이자 올 시즌 ‘우승 후보’로 꼽히는 KIA의... “아직 <b>날씨</b>가 쌀쌀해서 100% 컨디션이 올라오는 시기는 아닌 것 같다”면서도 “던지는 느낌 자체는... ,"Thu, 03 Apr 2025 08:02:00 +0900"
갑작스런 추위에 배 언피해…애타는 ‘농심’,https://www.nongmin.com/article/20250402500695,https://n.news.naver.com/mnews/article/662/0000065266?sid=102,임호열씨(79)는 “3월28일부터 <b>날씨</b>가 급격히 추워지면서 과수원 전체적으로 언피해가 발생했다”며... 각 시·군 농업기술센터에 따르면 3월29∼<b>4월</b>1일 아침 최저기온이 영하권으로 떨어지면서 나주(1748㏊)·영암(292... ,"Thu, 03 Apr 2025 08:01:00 +0900"
"한국인 검색량 1위 스페인…호텔스컴바인, 항공권 단독 특가 내놨다",https://www.mk.co.kr/article/11281237,https://n.news.naver.com/mnews/article/009/0005469918?sid=103,"마요르카는 연중 온화한 <b>날씨</b>와 에메랄드빛 해변으로 유명한 휴양지다. 한적한 마을과 자연이 함께 있어... 구매는 <b>4월</b> 14일까지, 탑승은 10월 25일까지다. 사회관계망서비스(SNS) 이벤트도 연다. 추첨을 통해 여행 지원금... ","Thu, 03 Apr 2025 08:01:00 +0900"
"세븐일레븐, <b>4월</b> 세븐카페 할인 프로모션 진행...레귤러 단돈 900원",http://www.issuenbiz.com/news/articleView.html?idxno=58431,http://www.issuenbiz.com/news/articleView.html?idxno=58431,나들이시즌 겨냥 세븐카페 프로모션/사진=세븐일레븐  편의점 세븐일레븐이 따뜻한 봄 <b>날씨</b>와 나들이... 세븐일레븐에 따르면 지난해 <b>4월</b> 세븐카페 아이스 매출은 전월 대비 40% 신장했고 올해 3월 매출도 전월 대비(2월)... ,"Thu, 03 Apr 2025 08:00:00 +0900"
"신세계, 면세 사업 경쟁 완화 등…1Q 저점찍고 실적 개선 전망-NH",http://www.edaily.co.kr/news/newspath.asp?newsid=01895846642132512,https://n.news.naver.com/mnews/article/018/0005977279?sid=101,"NH투자증권은 3일 신세계(004170)에 대해 <b>4월</b> 명품 특화 매장과 면세점 사업 경쟁 완화 등으로 1분기 저점에서... 명품 및 가전 카테고리 매출이 양호했으나, 비우호적인 <b>날씨</b> 영향으로 고마진 카테고리에 해당하는 의류... ","Thu, 03 Apr 2025 07:59:00 +0900"
"[기상청, 전국 지역별 오늘의 <b>날씨</b> 및 주말<b>날씨</b>]내일까지 낮과 밤 큰 기...",http://www.economytalk.kr/news/articleView.html?idxno=405384,http://www.economytalk.kr/news/articleView.html?idxno=405384,"o 건조주의보 : 경상북도(영덕, 울진평지, 포항, 경주 제외), 제주도(제주도남부), 대구 +주요지역별 <b>날씨</b>전망(<b>4월</b> 3일부터 <b>4월</b> 6일까지. 기상청 예보 전문) *서울-인천-경기 ○ 오늘 아침까지 경기내륙을 중심으로 짙은... ","Thu, 03 Apr 2025 07:56:00 +0900"
"진해구, 산불예방 홍보∙순찰 강화",https://www.newsfreezone.co.kr/news/articleView.html?idxno=618369,https://www.newsfreezone.co.kr/news/articleView.html?idxno=618369,진해구는 봄철 건조한 <b>날씨</b>와 강풍으로 산불발생 시 대형 산불 확산 우려가 높은 중요한 시기임을 감안해... 한편 제63회 진해군항제는 '설레는 봄의 매력'이란 슬로건으로 오는 <b>4월</b>6일까지 9일 동안 중원로터리를 비롯한... ,"Thu, 03 Apr 2025 07:50:00 +0900"
"[기상청, 오늘의 <b>날씨</b> 및 주말<b>날씨</b>]내일까지 낮과 밤 큰 기온차, 경북권...",http://www.economytalk.kr/news/articleView.html?idxno=405382,http://www.economytalk.kr/news/articleView.html?idxno=405382,"o 건조주의보 : 경상북도(영덕, 울진평지, 포항, 경주 제외), 제주도(제주도남부), 대구 *전국 중기 <b>날씨</b> 전망(<b>4월</b> 6일부터 <b>4월</b> 12일까지)9일 중부지방과 전북 비! &lt; 중점 사항 &gt; ○ (강수) 9일(수)은 중부지방(강원영동... ","Thu, 03 Apr 2025 06:58:00 +0900"
"[<b>날씨</b>]전국 대체로 구름 많고,미세먼지 농도 '보통' …낮 최고기온 12∼...",https://www.cbci.co.kr/news/articleView.html?idxno=494200,https://www.cbci.co.kr/news/articleView.html?idxno=494200,"/ 연합뉴스  전국적으로 봄비가 예고된 가운데, 낮과 밤의 기온 차가 큰 <b>날씨</b>가 이어질 전망이다. 기상청에 따르면 <b>4월</b> 3일 목요일은 전국에 가끔 구름이 많을 것으로 보이며, 특히 강원 영서와 충청권 내륙, 전북... ","Thu, 03 Apr 2025 06:54:00 +0900"
[오늘 <b>날씨</b>] 대구·경북 오늘 낮 최고 18도... 건조주의보 속 미세먼지 ...,https://www.dkilbo.com/news/articleView.html?idxno=490246,https://www.dkilbo.com/news/articleView.html?idxno=490246,3일 대구와 경북지역은  대체로 흐리다가 가끔 구름이 많을 것으로 보이는 가운데 봄<b>날씨</b>를 보이겠다.... 창원시는 영남권 대형산불 장기화로 오는 <b>4월</b> 6일까지 열리는 제63회 진해군항제를 대폭 축소해 진행한다.... ,"Thu, 03 Apr 2025 06:28:00 +0900"
[충청브리핑] 아산시장 재선거 오세현 전 시장 당선…‘3년만에 탈환’,https://cc.newdaily.co.kr/site/data/html/2025/04/03/2025040300019.html,https://cc.newdaily.co.kr/site/data/html/2025/04/03/2025040300019.html,"다음은 2025년 <b>4월</b> 3일 자 신문의 머리기사다. [정치] – 韓대행 “헌재 결과, 냉정하게 받아들여야”... 해 [<b>날씨</b>] – 충북 3일 오전까지 비·바람…예상 강수량 5~10㎜ [중부매일] [문화·생활] – 계속되는 극장가 한파에... ","Thu, 03 Apr 2025 06:26:00 +0900"
"25기 축구선수 영철, 중심 못 잡고 휘청 돌발 상황 ‘저혈압’ (나는 솔...",https://www.newsen.com/news_view.php?uid=202504030620111710,https://m.entertain.naver.com/article/609/0000971080,"<b>4월</b> 2일 방송된 ENA, SBS Plus ‘나는 SOLO’에서는 25기가 7시간 전 여자의 선택으로 데이트를 했다. 손을 잡고... 영철이 추운 <b>날씨</b>에 선택을 기다리며 서 있다가 갑자기 중심을 잡지 못하고 휘청거리는 모습에 급히 숙소... ","Thu, 03 Apr 2025 06:23:00 +0900"
대형산불 안심하긴 일러···건조 <b>날씨</b>에 전국 각지서 소규모 산불,https://www.ekn.kr/web/view.php?key=20250402029152893,https://www.ekn.kr/web/view.php?key=20250402029152893,"이원희 기자 wonhee4544@ekn.kr <b>4월</b>들어 전국서 산불 10차례 발생, 산림당국 긴장 5일 전국에 비 예보, 건조한 <b>날씨</b> 해소하긴 역부족 산불원인 행위자 3년 이하 징역, 3000만원 이하 벌금","Thu, 03 Apr 2025 06:20:00 +0900"
"[어제 야구] 근조리본 달고, 묵념 속에 다시 시작된 야구(4/2)",http://www.thesportstimes.co.kr/news/articleView.html?idxno=362049,https://m.sports.naver.com/kbaseball/article/472/0000036027,"2025년 <b>4월</b> 2일 수요일 프로야구 선수들이 유니폼에 근조 리본을 달고, 고개 숙여 묵념했다. 관중들의... <b>날씨</b>가 쌀쌀한 가운데 관중석은 지난 주와 달리 빈자리가 많이 보였다. 2025시즌 개막 후 이날 처음으로... ","Thu, 03 Apr 2025 06:11:00 +0900"
