title,originallink,link,description,pubDate
"서머너즈 워: 크로니클, 아레나 시스템 대폭 개편",https://www.startuptoday.co.kr/news/articleView.html?idxno=429808,https://www.startuptoday.co.kr/news/articleView.html?idxno=429808,이번 개편으로 월드 도전의 아레나에 '환경'과 '<b>날씨</b>' 요소가 추가됐다. 환경 요소는 두 유저 모두가 골드... 오는 <b>4월</b> 23일까지 각종 미션을 완료하면 보상과 함께 새로운 탈 것 '봄꽃 알파카'를 획득할 수 있는 이벤트가... ,"Fri, 04 Apr 2025 10:52:00 +0900"
"이상기후로 늦어지는 과수 개화기, 냉해 등 저온 피해 발생 중",http://www.newsam.co.kr/news/article.html?no=39802,http://www.newsam.co.kr/news/article.html?no=39802,"냉해 등 저온 피해 예방 위해 적극적인 영양제 처방 필요 천지바이오, '허니비, 매직팜' 적극 권장 농업<b>날씨</b>365... 하지만 인공수분 작업이 진행된 이후인 <b>4월</b> 초·중순경에나 피해 규모를 확인할 수 있기 때문에 꽃봉오리... ","Fri, 04 Apr 2025 10:48:00 +0900"
"<b>4월</b> 초 광주광역시 가볼만한곳, <b>날씨</b>별로 골라보는 코스",https://www.tournews21.com/news/articleView.html?idxno=97573,https://www.tournews21.com/news/articleView.html?idxno=97573,"<b>4월</b> 11일부터 주말까지는 맑고 따뜻한 <b>날씨</b>가 이어질 전망이다. 가족이나 친구들과 함께 1913송정역시장, 충장로 문화의 거리, 광주 폴리투어 등 도시형 체험이 가능한 여행 코스를 구성하면 좋다. 이번 주 광주는 <b>4월</b>... ","Fri, 04 Apr 2025 10:48:00 +0900"
"[기상청, 오늘의 <b>날씨</b> 및 내일<b>날씨</b>]경북권내륙 대기 매우 건조, 내일 전...",http://www.economytalk.kr/news/articleView.html?idxno=405465,http://www.economytalk.kr/news/articleView.html?idxno=405465,"중기 <b>날씨</b> 전망(<b>4월</b> 8일부터 <b>4월</b> 14일까지)9일 오후 제주도, 10일 전국 비! &lt; 중점 사항 &gt; ○ (강수) 9일(수)은 제주도에, 10일(목)은 전국(강원영동 제외)에 비가 오겠다. ○ (기온) 이번 예보기간 아침 기온은 4~12도, 낮... ","Fri, 04 Apr 2025 10:46:00 +0900"
"조현준 효성 회장, 전력기기 호황에도 신성장동력 육성한다",https://www.inthenews.co.kr/news/article.html?no=71022,https://www.inthenews.co.kr/news/article.html?no=71022,"시스템으로, <b>날씨</b>에 따라 발전량이 변하는 신재생에너지의 단점 보완에 필수적입니다. 효성중공업은... 효성중공업은 지난해 <b>4월</b> 세계 최초로 수소엔진발전기 상용화에 성공했습니다. 효성중공업 수소엔진발전기는 100... ","Fri, 04 Apr 2025 10:34:00 +0900"
이엑스스포테인먼트 '2025 더캠핑쇼 in 광주' <b>4월</b> 10일 개최,https://www.dailysportshankook.co.kr/news/articleView.html?idxno=402705,https://www.dailysportshankook.co.kr/news/articleView.html?idxno=402705,"더캠핑쇼 사무국이 주최하는 '2025 더캠핑쇼'가 오는 <b>4월</b> 10일(목)부터 13일(일)까지 광주... 예정으로, <b>날씨</b> 좋은 봄 캠핑을 준비하는 캠퍼들의 이목을 끌만한 제품들을 특별한 가격에 구매할 수 있다. 더캠핑쇼 기간... ","Fri, 04 Apr 2025 10:32:00 +0900"
"2025년 <b>4월</b>, 어디서 꽃구경할까? 전국 꽃축제 총정리",https://www.tournews21.com/news/articleView.html?idxno=97557,https://www.tournews21.com/news/articleView.html?idxno=97557,"꽃박람회는 <b>4월</b> 25일부터 5월 11일까지 경기도 고양시 일산 호수공원에서 열린다. 세계 각국의 화훼 전문가들이 참여하는 대규모 꽃 박람회로, 다양한 꽃 전시와 체험 프로그램이 마련되어 있다. 각 축제의 일정은 <b>날씨</b>... ","Fri, 04 Apr 2025 10:26:00 +0900"
"&quot;새 단장 했어요&quot;...이랜드이츠 로운 샤브샤브·매드포갈릭, 손님 맞이 ...",http://www.popcornnews.net/news/articleView.html?idxno=76568,http://www.popcornnews.net/news/articleView.html?idxno=76568,"따뜻해진 <b>날씨</b>와 함께 새 단장을 끝내고 본격 손님 맞이 준비에 나선 업계 소식을 알아본다. 이랜드이츠의... 이에 따라, <b>4월</b> 3일 매드포갈릭 건대스타시티점이 기존 지하 1층에서 9층으로 자리를 옮긴데 이어, <b>4월</b> 4일... ","Fri, 04 Apr 2025 10:20:00 +0900"
"유한킴벌리, 여름철 맞춤형 생리대 확장…'화이트 스테이쿨' 출시",https://www.news1.kr/industry/general-industry/5742610,https://n.news.naver.com/mnews/article/421/0008173037?sid=101,"점점 무덥고 길어지는 여름 <b>날씨</b>로 인해 무덥고 습한 여름철에 편안하게 사용할 수 있는 생리대가 트렌드로... <b>4월</b> 중순부터 올리브영, 이마트 등 전국 주요 온·오프라인에서 채널에서 구매할 수 있다. 화이트 담당자는... ","Fri, 04 Apr 2025 10:20:00 +0900"
"<b>4월</b> 초 횡성, <b>날씨</b>만 보고도 완성되는 여행 코스",https://www.tournews21.com/news/articleView.html?idxno=97547,https://www.tournews21.com/news/articleView.html?idxno=97547,주말인 <b>4월</b> 12일과 13일은 맑은 <b>날씨</b>에 기온도 17~20도 수준으로 안정적인 기상 조건이 예측된다. 가족 단위 여행객에게는 횡성 온천랜드나 횡성시장 주말장터 방문이 유익한 일정이 될 수 있다. 이번 주 횡성은 <b>4월</b>... ,"Fri, 04 Apr 2025 10:20:00 +0900"
[그래픽] [주말 고속도로] 봄꽃 개화…경부선·서해안선 등 혼잡,https://www.newsis.com/view/NISI20250404_0001809504,https://n.news.naver.com/mnews/article/003/0013163658?sid=102,"<b>4월</b> 첫 번째 주말은 따뜻한 <b>날씨</b>, 봄꽃 개화로 전국 교통량이 평소보다 증가할 것으로 보인다. 경부선과 영동선, 서해안선 등 주요노선과 상습정체구간 위주로 혼잡할 전망이다.(그래픽=안지혜 기자)","Fri, 04 Apr 2025 10:18:00 +0900"
"<b>4월</b> 성주, <b>날씨</b>만 보고도 완성되는 맞춤형 여행 플랜",https://www.tournews21.com/news/articleView.html?idxno=97552,https://www.tournews21.com/news/articleView.html?idxno=97552,"2025년 <b>4월</b> 4일부터 13일까지 성주 지역의 주간 <b>날씨</b>에 따라 여행지를 추천할 수 있다. <b>4월</b> 4일과 6일은 최저기온 1~3도, 최고기온은 18~20도로 다소 서늘하지만 대체로 맑은 <b>날씨</b>가 이어질 전망이다. 이 시기에는... ","Fri, 04 Apr 2025 10:16:00 +0900"
"[TRAVEL] 태평양의 푸른 보석, 사이판으로 떠나는 힐링 여행",http://fpn119.co.kr/232446,http://fpn119.co.kr/232446,이 시기는 건기로 맑고 따뜻한 <b>날씨</b>가 이어지며 해양 활동을 즐기기에 최적기다. 여름철(6~10월)은 태풍의... 2025년 <b>4월</b> 호에서도 만나볼 수 있습니다.&gt; 119플러스 정기 구독 신청 바로가기 119플러스 네이버스토어 구독... ,"Fri, 04 Apr 2025 10:10:00 +0900"
"&quot;더운 가을·겨울, 추운 봄에 양파 생산량이 급감했어요&quot;",http://www.mdilbo.com/detail/c3QycN/740870,http://www.mdilbo.com/detail/c3QycN/740870,<b>날씨</b>가 요란스럽더니 조생종은 냉해 피해가 심각하다&quot;면서 &quot;만생종도 바이러스에 감염돼 예년에 비해 3분의 1정도는 버려야 할 판&quot;이라고 한숨을 내쉬었다. 양파는 수확 시기를 기준으로 9~10월에 파종해 <b>4월</b>에... ,"Fri, 04 Apr 2025 10:08:00 +0900"
전 구단 아우르는 국내 야구 팬 커뮤니티 '야구왕' 공식 오픈,http://www.e2news.com/news/articleView.html?idxno=318584,http://www.e2news.com/news/articleView.html?idxno=318584,"'한화이글스 신구장에 편의점 특화 매장 오픈', '<b>4월</b> 경기 일정 변경 소식', '<b>날씨</b> 정보' 등 스포츠 관련 이슈 게시글이 업로드되면서 자연스러운 소통의 장으로 발전 중이다. 야구왕 관계자는 &quot;야구왕은 진짜 야구 팬들이... ","Fri, 04 Apr 2025 10:06:00 +0900"
비 오는 날도 OK 영종도 실내외 여행지 추천 TOP 7,https://www.tournews21.com/news/articleView.html?idxno=97540,https://www.tournews21.com/news/articleView.html?idxno=97540,"특히 <b>4월</b> 9일은 구름이 다소 끼는 <b>날씨</b>로, 강한 햇빛이 부담스럽지 않아 산책이나 트레킹에 알맞은 환경이다. <b>4월</b> 11일부터 주말인 13일까지는 대체로 맑은 <b>날씨</b>가 이어지고, 기온도 13~16도 수준으로 유지될 전망이다.... ","Fri, 04 Apr 2025 10:02:00 +0900"
'오늘 광주' <b>4월</b> 4일 광주드림 카드뉴스,http://www.gjdream.com/news/articleView.html?idxno=655456,http://www.gjdream.com/news/articleView.html?idxno=655456,"세대 왜 외면하나 [애증의 보해] 중장년 복잡한 속내 [애증의 보해] 광주·전남 '300ml' 파동 오늘 탄핵 심판 선고, 윤 대통령 운명은? 영암군 음식점·숙박업소 등 단장 지원 '무등시장 디지털 상점화' 첫걸음 오늘 광주 <b>날씨</b>","Fri, 04 Apr 2025 09:58:00 +0900"
"이번 주 청도 <b>날씨</b>별 여행지 총정리, 비 오는 날도 걱정 없다",https://www.tournews21.com/news/articleView.html?idxno=97535,https://www.tournews21.com/news/articleView.html?idxno=97535,주말인 <b>4월</b> 12일과 13일은 맑은 <b>날씨</b>가 이어지며 기온도 20~22도로 야외 활동에 좋은 환경이 예상된다. 청도 유등연지 생태공원이나 청도 천문우주과학관 방문이 가족 단위 여행객에게 추천된다. 이번 주 청도 <b>날씨</b>는... ,"Fri, 04 Apr 2025 09:58:00 +0900"
"안동시, 산불 예방 위한 행위제한 행정명령 발령",https://www.pressian.com/pages/articles/2025040409523463391?utm_source=naver&utm_medium=search,https://n.news.naver.com/mnews/article/002/0002381747?sid=102,"입산통제구역 출입은 입산 허가증 발급받아야 가능 안동시는 최근 건조한 <b>날씨</b>와 강풍으로 인해 대형산불 발생 위험이 증가함에 따라, 산불 예방을 위한 행위제한 행정명령을 <b>4월</b> 3일(목)부터 별도 해제 시까지 발령했다.... ","Fri, 04 Apr 2025 09:56:00 +0900"
"봄바람 부는 홍천, <b>날씨</b>별 추천 나들이 명소 7선",https://www.tournews21.com/news/articleView.html?idxno=97529,https://www.tournews21.com/news/articleView.html?idxno=97529,주말인 <b>4월</b> 12일과 13일은 맑은 <b>날씨</b>와 18~20도의 온화한 기온이 예상된다. 홍천 동키힐 목장 체험이나 수타사 템플스테이 등 가족 단위의 체험형 여행지 방문이 적합하다. 이번 주 홍천은 간헐적인 비를 제외하면 대체로... ,"Fri, 04 Apr 2025 09:54:00 +0900"
<b>4월</b> 3일 이브닝뉴스 헤드라인,https://www.radiokorea.com/news/article.php?uid=469863,https://www.radiokorea.com/news/article.php?uid=469863,11. 탄핵 심판 선고를 앞두고 헌법재판소 일대에서 탄핵 찬반 시민 20만여명이 모일 것으로 알려졌다. 경찰이 최고 수준의 비상근무체제인 ‘갑호비상’을 발령하고 집회·시위 총력전에 나섰다. 12. <b>날씨</b>,"Fri, 04 Apr 2025 09:50:00 +0900"
이번 주 광주 <b>날씨</b> 따라 가볼만한 여행지 완벽 정리,https://www.tournews21.com/news/articleView.html?idxno=97527,https://www.tournews21.com/news/articleView.html?idxno=97527,주말인 <b>4월</b> 12일과 13일은 비교적 맑은 <b>날씨</b>로 21도 안팎의 온도를 보일 예정이다. 이틀간은 1913송정역시장이나 충장로 문화의 거리에서 광주의 로컬 문화를 경험해볼 수 있는 좋은 기회이다. 이번 주 광주광역시 <b>날씨</b>는... ,"Fri, 04 Apr 2025 09:42:00 +0900"
"유한킴벌리, 여름철 겨냥 '화이트 스테이쿨 생리대' 출시",https://www.econovill.com/news/articleView.html?idxno=690571,https://www.econovill.com/news/articleView.html?idxno=690571,"점점 무덥고 길어지는 여름 <b>날씨</b>로 인해, 무덥고 습한 여름철에 편안하게 사용할 수 있는 생리대가 새로운... <b>4월</b> 중순부터 올리브영, 이마트 등 전국 주요 온·오프라인에서 채널에서 구매할 수 있다. 화이트 담당자는... ","Fri, 04 Apr 2025 09:20:00 +0900"
봄꽃 개화…경부선·서해안선 등 혼잡[주말·휴일고속도로],https://www.newsis.com/view/NISX20250404_0003126339,https://n.news.naver.com/mnews/article/003/0013163416?sid=101,"<b>4월</b> 첫 번째 주말은 따뜻한 <b>날씨</b>, 봄꽃 개화로 전국 교통량이 평소보다 증가할 것으로 보인다. 경부선과 영동선, 서해안선 등 주요노선과 상습정체구간 위주로 혼잡할 전망이다. 4일 한국도로공사의 주말 교통량 전망에... ","Fri, 04 Apr 2025 09:19:00 +0900"
고물가에 편의점 '가성비 1000원 커피' 매출 '쑥',https://www.widedaily.com/news/articleView.html?idxno=264083,https://www.widedaily.com/news/articleView.html?idxno=264083,따뜻한 봄 <b>날씨</b>와 나들이 시즌을 맞아 저렴한 가격으로 즐길 수 있는 편의점 커피를 찾는 수요가 증가한... <b>4월</b> 한 달간 오전 7시부터 11시까지 카카오페이머니로 결제하면 '세븐카페 아이스 레귤러'를 50% 할인된... ,"Fri, 04 Apr 2025 09:18:00 +0900"
평창군 “불법소각 행위 24시간 단속 등 엄중 처벌”,https://www.sportsseoul.com/news/read/1506223?ref=naver,https://n.news.naver.com/mnews/article/468/0001137480?sid=102,한식(<b>4월</b> 6일)을 앞두고 산불취약지역을 중심으로 불법소각 행위를 강력히 단속하고 엄중 처벌한다는 방침이다. 이성모 군 산림과장은 “봄철은 <b>날씨</b>가 건조하고 강풍이 자주 불어 대형산불 발생 위험이 크다”며... ,"Fri, 04 Apr 2025 09:11:00 +0900"
활력 넘치는 서산시 건설을 위한 다양한 활동 추진,https://www.joongdo.co.kr/web/view.php?key=20250404010001492,https://www.joongdo.co.kr/web/view.php?key=20250404010001492,"가티와 오슈 이모티콘은 <b>4월</b> 7일 오후 2시부터 선착순 2만 5천 명에게 무료로 배포되며, 받은 후 30일까지... 산불 발생 위험이 큰 건조한 <b>날씨</b>가 지속됨에 따라 음암면에서는 주민들에게도 산불 예방에 적극 동참해 줄 것을... ","Fri, 04 Apr 2025 09:06:00 +0900"
“지금은 양심과 염치 사라진 시대… 가장 비극적”,https://shindonga.donga.com/3/all/13/5530177/1,https://n.news.naver.com/mnews/article/262/0000018256?sid=102,우리가 피부로는 느끼지 못해도 <b>4월</b> 지나서 5월 6월 지나면 음 기운이 올라옵니다. 이걸 사람 힘으로 막을 수는... 27장 “<b>날씨</b>가 추워진 뒤에야 소나무와 측백나무가 시듦을 안다”에서 따왔다고 한다. 봄과 여름에는 모든... ,"Fri, 04 Apr 2025 09:01:00 +0900"
"[Issue+] 길어지는 AI, 가금업계 현장은",http://www.aflnews.co.kr/news/articleView.html?idxno=292686,http://www.aflnews.co.kr/news/articleView.html?idxno=292686,"그러나 지난달 25일 세종의 산란계농장에서 H5 AI항원이 발생되면서 사실상 특방기간이 <b>4월</b>까지 연장될 수... 있다&quot;며 &quot;<b>날씨</b> 영향을 많이 받은 것으로 보인다&quot;고 밝혔다. # 미국, 고병원성 AI로 인해 계란가격 폭등 중 이... ","Fri, 04 Apr 2025 09:00:00 +0900"
[<b>날씨</b>] <b>4월</b> 4일(금) 대구·경북 낮 14~19도… 토요일 비,http://news.lghellovision.net/news/articleView.html?idxno=502398,http://news.lghellovision.net/news/articleView.html?idxno=502398,"- 건조주의보: 대구, 경상북도(영덕, 울진평지, 포항, 경주 제외) - 대구, 경북내륙은 대기가 매우 건조하겠습니다. - 오늘 내륙을 중심으로 낮과 밤의 기온차가 15도 내외로 크겠습니다. - 내일 오전부터 밤사이 대구... ","Fri, 04 Apr 2025 08:58:00 +0900"
올봄 첫 '초미세먼지 비상저감조치' 발령,https://jhealthmedia.joins.com/news/articleView.html?idxno=29991,https://jhealthmedia.joins.com/news/articleView.html?idxno=29991,"<b>날씨</b>나 계절에 상관없이 매일 아침과 저녁에 비타민C 스킨케어로 관리하는 것을 추천해. 개인에게 맞는 적절한 용량을 파악해 사용해야 한다는 점도 잊지 말고! <b>4월</b> 4일, 오늘은 피부 건강과 아름다움을 위한... ","Fri, 04 Apr 2025 08:50:00 +0900"
[전북 <b>날씨</b>]<b>4월</b> 4일 짙은 안개…&quot;일교차 커&quot;,http://news.lghellovision.net/news/articleView.html?idxno=502394,http://news.lghellovision.net/news/articleView.html?idxno=502394,"오늘(4일) 아침까지 전북 내륙과 서해안에는 짙은 안개가 끼는 곳이 있겠습니다. 오늘 낮 최고 기온은 14~18도로, 낮과 밤의 기온차가 크겠습니다. 내일(5일) 늦은 새벽부터 전북 서해안에 비가 내리기 시작해, 오전에는... ","Fri, 04 Apr 2025 08:36:00 +0900"
"【김형주, 장정민의 지속가능경영 스토리】ESG 관점에서 본 경북 산불의...",http://www.impacton.net/news/articleView.html?idxno=14610,http://www.impacton.net/news/articleView.html?idxno=14610,"82건씩 증가하여 연간 약 451건에 이르고, 산불 시즌도 <b>4월</b> 초에서 3월 중순으로 약 10일 이상 앞당겨졌다. 그만큼 이른 봄부터 건조한 <b>날씨</b>에 산불이 빈번하게 발생하게 된 것이다. 이번 영남 지역 산불 역시 이상고온과... ","Fri, 04 Apr 2025 08:34:00 +0900"
"대구·경북 오늘의 <b>날씨</b> (<b>4월</b> 4일)…낮 최고기온 대구·안동 18, 구미 19,...",https://www.yeongnam.com/web/view.php?key=20250404010000427,https://www.yeongnam.com/web/view.php?key=20250404010000427,대구·경북 가끔 구름 많음,"Fri, 04 Apr 2025 08:16:00 +0900"
"[기상청, 오늘의 <b>날씨</b> 및 주말<b>날씨</b>]경북권내륙 대기 매우 건조, 내일 전...",http://www.economytalk.kr/news/articleView.html?idxno=405450,http://www.economytalk.kr/news/articleView.html?idxno=405450,서해중부바깥먼바다 +주요지역별 <b>날씨</b>전망(<b>4월</b> 4일부터 <b>4월</b> 7일까지. 기상청 예보 전문) *서울-인천-경기 &lt;예비특보&gt; ○ 강풍예비특보: 서해5도(5일 새벽(00~06시)) ○ 풍랑예비특보: 서해중부먼바다(5일 새벽(00~06시)... ,"Fri, 04 Apr 2025 08:02:00 +0900"
초여름 더위 일찍 온다…편의점 <b>4월</b> 아이스 커피 매출 ‘쑥’,https://www.inthenews.co.kr/news/article.html?no=71003,https://www.inthenews.co.kr/news/article.html?no=71003,"편의점 관계자는 “3월 대비 <b>4월</b>은 <b>날씨</b>가 따뜻해지면서 아이스커피, 얼음 등 시원하게 즐길 수 있는 상품 매출이 급증한다”며 “커피전문점의 커피 가격이 인상되면서 맛과 품질에서 뒤쳐지지 않으면서... ","Fri, 04 Apr 2025 08:00:00 +0900"
트럼프 상호관세 충격…韓 수출경쟁력 흔들 [3분 브리프],https://view.asiae.co.kr/article/2025040315205167849,https://n.news.naver.com/mnews/article/277/0005572780?sid=101,대비 <b>4월</b> 가계대출 증가폭 늘어 ○올해 특히 봄 이사철 수요·금리인하 기대감·토허제 해제 맞물려... (3월) ◇점심&amp;퇴근길 <b>날씨</b> ○최저기온 6℃(0℃) ｜최고기온 : 16℃(▼1℃) ○강수확률 오전 0%｜오후 0... ,"Fri, 04 Apr 2025 08:00:00 +0900"
[오늘<b>날씨</b>] &quot;<b>4월</b>인데 아직도&quot;⋯'낮 포근·밤 쌀쌀' 큰 일교차 여전,http://www.inews24.com/view/1830740,https://n.news.naver.com/mnews/article/031/0000921809?sid=103,"4일인 금요일은 전국이 포근한 <b>날씨</b>를 보이는 가운데 큰 일교차에 주의해야겠다. 이날 기상청 등에 따르면 당분간 기온은 평년(최저 0~8도, 최고 14~19도)과 비슷하겠으며 낮과 밤의 기온차가 15도 내외로 매우 크겠다.... ","Fri, 04 Apr 2025 07:40:00 +0900"
"[부산 브리핑 모음(<b>4월</b>4일)] 부산 기장군, ‘농업기상재해 조기경보서비...",https://www.dnews.co.kr/uhtml/view.jsp?idxno=202504032246444250048,https://www.dnews.co.kr/uhtml/view.jsp?idxno=202504032246444250048,"<b>4월</b>부터 본격적인 행락철을 맞아 많은 시민들이 방문하는 인기 명소로 자리 잡고 있으며, 이에 따라 공단은 시민 편의를 고려해 잔디광장의 조기 개방을 결정했다. 이번 개방을 통해 시민들은 따뜻한 봄 <b>날씨</b> 속에서... ","Fri, 04 Apr 2025 07:40:00 +0900"
"[<b>날씨</b>] 청명한 <b>날씨</b> 속 일교차 큰 전북…낮 최고 18도, 미세먼지 농도는...",https://www.cbci.co.kr/news/articleView.html?idxno=494490,https://www.cbci.co.kr/news/articleView.html?idxno=494490,"전북 지역은 <b>4월</b> 4일 청명(淸明)을 맞아 하늘이 맑아지며 금요일의 시작을 알렸다. 이날 전북의 주요... 이는 전형적인 봄 <b>날씨</b>로, 아침의 쌀쌀한 기운을 반영하고 있다. 낮 동안에는 기온이 14도에서 18도 사이로 오를... ","Fri, 04 Apr 2025 07:26:00 +0900"
"2025년 청명 &quot;춘분과 곡우 사이의 절기, 청명과 한식에 <b>날씨</b>가 좋으면 풍...",https://www.lecturernews.com/news/articleView.html?idxno=175174,https://www.lecturernews.com/news/articleView.html?idxno=175174,"청명이 드는 날이 <b>4월</b> 5일 식목일과 겹치듯, 초목이 새로 자라기 시작하는 봄의 중심을 말한다. 청명이란 말 그대로 <b>날씨</b>가 좋은 날이고, <b>날씨</b>가 좋아야 봄에 막 시작하는 농사일이나 고기잡이 같은 생업 활동을... ","Fri, 04 Apr 2025 07:18:00 +0900"
"[쏠리는 눈] 주민 생활체육 활성화 나선 청주시, 푸르미환경공원 실내 ...",https://www.psnews.co.kr/news/articleView.html?idxno=2087812,https://www.psnews.co.kr/news/articleView.html?idxno=2087812,시는 기존 실외 게이트볼장이 노후한데다 계절과 <b>날씨</b> 등 외부 여건에 제약을 받는 점을 개선하기 위해... 실내 게이트볼장을 운영한다. 공단과 운영계획 등에 대한 협의가 마무리되는 대로 <b>4월</b> 중순부터 개방할 예정이다.,"Fri, 04 Apr 2025 07:12:00 +0900"
오늘은 '청명' 24절기 중 다섯 번째 절기…한식에 죽으나 청명에 죽으나...,https://www.etoday.co.kr/news/view/2458913,https://www.etoday.co.kr/news/view/2458913,"태양의 황경(黃經)이 15도에 있을 때이며, 말 그대로 <b>날씨</b>가 좋은 때라 봄에 막 시작하는 농사일이나... 올해 한식은 다음날인 <b>4월</b> 5일이다. 한식은 한국 명절 중 하나로 설날, 정월 대보름, 단오, 추석과 더불어 5대 명절로... ","Fri, 04 Apr 2025 07:02:00 +0900"
"화제작 '딩컴', 이번 주말 무료로 즐기자 [오늘의 게임 업데이트]",https://www.sedaily.com/NewsView/2GRE2PDMVP,https://n.news.naver.com/mnews/article/011/0004469945?sid=105,‘환경’과 ‘<b>날씨</b>’ 요소를 추가하는 등 대대적인 개편을 진행했다. 월드 도전 아레나에서는 골드·마스터 랭크 이상 유저에게 각각 환경·<b>날씨</b> 요소가 적용되며 각 시즌에 따라 특수 효과가 부여된다. 격전의... ,"Fri, 04 Apr 2025 07:01:00 +0900"
고물가에 편의점 '가성비 1000원 커피' 매출 '쑥',https://www.newsis.com/view/NISX20250403_0003125971,https://n.news.naver.com/mnews/article/003/0013163174?sid=101,따뜻한 봄 <b>날씨</b>와 나들이 시즌을 맞아 저렴한 가격으로 즐길 수 있는 편의점 커피를 찾는 수요가 증가한... <b>4월</b> 한 달간 오전 7시부터 11시까지 카카오페이머니로 결제하면 '세븐카페 아이스 레귤러'를 50% 할인된... ,"Fri, 04 Apr 2025 07:00:00 +0900"
"지드래곤 “찬 공기 마시며 라이브 말도 안 돼” 걱정할 만, 꽁꽁 싸맨 ...",https://www.newsen.com/news_view.php?uid=202504040655032110,https://m.entertain.naver.com/article/609/0000971490,"<b>4월</b> 3일 지드래곤 측의 계정으로 알려진 '8lo8lo8lowme' 소셜미디어에는 별 다른 글 없이 사진이 게재됐다. 공개된 사진에는 월드투어의 포문을 알린 한국 콘서트 전, 지드래곤의 리허설 모습 등이 담겼다. 추운 <b>날씨</b>를... ","Fri, 04 Apr 2025 06:56:00 +0900"
"[기상청, 오늘의 <b>날씨</b> 및 주말<b>날씨</b>]경북권내륙 대기 매우 건조, 내일 전...",http://www.economytalk.kr/news/articleView.html?idxno=405448,http://www.economytalk.kr/news/articleView.html?idxno=405448,"중기 <b>날씨</b> 전망(<b>4월</b> 7일부터 <b>4월</b> 13일까지)9일 중부지방과 전북, 제주도 비! &lt; 중점 사항 &gt; ○ (강수) 9일(수)은 중부지방(강원영동 제외)과 전북, 제주도에 비가 오겠다. ○ (기온) 이번 예보기간 아침 기온은 2~12도, 낮... ","Fri, 04 Apr 2025 06:26:00 +0900"
식목일 전국에 봄비…다음 주 한낮 20도 웃돌아,http://www.yonhapnewstv.co.kr/MYH20250404060502985,https://n.news.naver.com/mnews/article/422/0000727719?sid=103,[기자] <b>4월</b>에 들어서며 봄기운이 더 짙어졌습니다. 포근한 <b>날씨</b>에 옷차림도 한결 가벼워졌습니다. 하늘이 차츰 맑아진다는 절기상 '청명'인 금요일도 온화한 <b>날씨</b>가 계속됩니다. 식목일인 토요일에는 전국 곳곳에 비가... ,"Fri, 04 Apr 2025 06:05:00 +0900"
