title,originallink,link,description,pubDate
"[기고] 산불과 기후위기 시대, 공간정보로 그리는 미래의 숲",http://www.ikld.kr/news/articleView.html?idxno=310765,http://www.ikld.kr/news/articleView.html?idxno=310765,매년 <b>4월</b> 5일 식목일이 다가오면 전국 곳곳에서 나무 심기 행사가 열린다. 나무 한 그루 한 그루를 심으며... 기후변화로 인해 건조한 <b>날씨</b>가 지속되고 바람이 강해지면서 산불은 더욱 빠르게 확산되고 있다. 산불을... ,"Wed, 02 Apr 2025 09:34:00 +0900"
소상공인·전통시장 &quot;봄<b>날씨</b>에 체감경기↑…전망은 암울&quot;,https://www.newsis.com/view/NISX20250402_0003122982,https://n.news.naver.com/mnews/article/003/0013157781?sid=101,봄을 맞아 <b>날씨</b>가 풀리면서 소상공인과 전통시장에 사람들의 발길이 찾아들기 시작했다. '명절 특수... 소상공인과 전통시장 상인들이 전망하는 <b>4월</b> 경기 전망 BSI는 소폭 올랐으나 여전히 기준치(100)를 훨씬... ,"Wed, 02 Apr 2025 09:32:00 +0900"
"뉴워커, 러닝대회·걷기대회 긱 일자리 소개",https://zdnet.co.kr/view/?no=20250402090809,https://n.news.naver.com/mnews/article/092/0002369039?sid=105,특히 러닝의 계절인 따뜻해진 봄 <b>날씨</b>를 맞아 긱워커들 사이에도 러닝 대회 긱의 인기가 높아지고 있다.... 해당 긱은 <b>4월</b> 4일부터 5일까지 평택시 이충레포츠공원 일대에서 진행한다. 4일은 행사장 세팅과 사전 교육을... ,"Wed, 02 Apr 2025 09:30:00 +0900"
"호텔스컴바인, 스페인관광청•티웨이항공과 스페인 지역 홍보 캠페인 실...",https://www.discoverynews.kr/news/articleView.html?idxno=1061103,https://www.discoverynews.kr/news/articleView.html?idxno=1061103,"마요르카는 연중 온화한 <b>날씨</b>와 에메랄드빛 해변이 매력적인 대표 휴양지로, 다양한 해변 명소와 한적한... 구매 기간은 2025년 <b>4월</b> 14일까지이며, 탑승 기간은 2025년 10월 25일까지다. 호텔스컴바인의 스페인 항공권 단독... ","Wed, 02 Apr 2025 09:22:00 +0900"
[R]산불 <b>4월</b> 중순까지 최대 고비 '계도 대신 처벌',http://andongmbc.co.kr/adboard/NewsView74849,http://andongmbc.co.kr/adboard/NewsView74849,특히 건조한 가운데 돌풍이 부는 <b>날씨</b>가 이어지면서 대형 산불 발생 위험성도 계속되고 있습니다. 충남에서... &quot; 산불 위기 심각 단계에 따른 비상근무에 돌입한 충남도와 일선 시군은 청명과 한식이 있는 이번 주부터 <b>4월</b>... ,"Wed, 02 Apr 2025 09:16:00 +0900"
2025년 <b>4월</b> 2일 항공리포트,https://news.ifm.kr/news/articleView.html?idxno=414063,https://news.ifm.kr/news/articleView.html?idxno=414063,"현재 인천공항은 구름 조금 낀 <b>날씨</b>를 보이고 있는데요, 눈으로 확인할 수 있는 최대거리는 6000m입니다. 오늘은 점차 북쪽을 지나는 기압골의 영향을 받아 구름 많고 오후 한때 비가 내리겠습니다. 인천의 현재기온은 5.... ","Wed, 02 Apr 2025 09:12:00 +0900"
[<b>날씨</b>] <b>4월</b> 2일(수) 대구·경북 낮 12~19도… 밤부터 한때 비,http://news.lghellovision.net/news/articleView.html?idxno=502078,http://news.lghellovision.net/news/articleView.html?idxno=502078,"- 건조주의보: 대구, 경상북도 - 당분간 대구, 경북은 대기가 매우 건조하겠습니다. - 당분간 낮과 밤의 기온차가 15도 내외로 크겠습니다. - 오늘 밤부터 내일 새벽 사이 대구, 경북내륙에는 한때 비가 내리는 곳이... ","Wed, 02 Apr 2025 08:54:00 +0900"
러닝 열풍 느끼고 싶다면?…뉴워커에서 러닝 대회 '긱' 참여하자,http://www.veritas-a.com/news/articleView.html?idxno=548088,http://www.veritas-a.com/news/articleView.html?idxno=548088,특히 러닝의 계절인 따뜻해진 봄 <b>날씨</b>를 맞아 긱워커들 사이에도 러닝 대회 긱의 인기가 높아지고 있다.... 해당 긱은 <b>4월</b> 4일부터 5일까지 평택시 이충레포츠공원 일대에서 진행한다. 4일은 행사장 세팅과 사전 교육을... ,"Wed, 02 Apr 2025 08:54:00 +0900"
[전북 <b>날씨</b>]<b>4월</b> 2일 대기 건조…오후부터 비,http://news.lghellovision.net/news/articleView.html?idxno=502075,http://news.lghellovision.net/news/articleView.html?idxno=502075,"전북 무주와 남원에 건조주의보가 내려져 있는 가운데, 오늘(2일) 늦은 오후부터 밤사이 북부 지역에 5mm 미만의 비가 내릴 예정입니다. 전북 남부에도 0.1mm 미만의 빗방울이 떨어지는 곳이 있겠습니다. 오늘 아침... ","Wed, 02 Apr 2025 08:54:00 +0900"
"뉴워커, 이색적인 러닝 대회 긱(Gi) 소개",http://www.lawissue.co.kr/view.php?ud=202504020843079031204ead0791_12,http://www.lawissue.co.kr/view.php?ud=202504020843079031204ead0791_12,봄 <b>날씨</b>를 맞아 긱워커들 사이에도 러닝 대회 긱의 인기가 높아지고 있다&quot;라고 전했다. 이어 &quot;▲평택시민... 해당 긱은 <b>4월</b> 4일부터 5일까지 평택시 이충레포츠공원 일대에서 진행한다. 4일은 행사장 세팅과 사전 교육을... ,"Wed, 02 Apr 2025 08:46:00 +0900"
"당진소방서, 청명·한식 및 재·보궐선거 특별 경계근무 돌입",https://www.joongdo.co.kr/web/view.php?key=20250402010000515,https://www.joongdo.co.kr/web/view.php?key=20250402010000515,"따르면 <b>4월</b>은 연중 네 번째로 화재 발생 빈도가 높은 달이다. 특히 임야화재 발생 원인의 86% 이상이 부주의로 인한 것으로 나타났다. 기상청의 전망에 따르면 해당 기간 동안 건조한 <b>날씨</b>와 큰 일교차, 바람 등의 기후... ","Wed, 02 Apr 2025 08:32:00 +0900"
"대구·경북 오늘의 <b>날씨</b> (<b>4월</b> 2일)…낮 최고기온 대구·구미 18, ·안동 1...",https://www.yeongnam.com/web/view.php?key=20250402010000172,https://www.yeongnam.com/web/view.php?key=20250402010000172,대구·경북 대체로 맑다가 차차 흐려짐,"Wed, 02 Apr 2025 08:28:00 +0900"
헌법재판소에 윤석열 대통령 탄핵 촉구,https://mpmbc.co.kr/NewsArticle/1456244,https://mpmbc.co.kr/NewsArticle/1456244,"그간 시민들은 영하의 <b>날씨</b>를 뚫고 광장에 모이는가 하면, 단식 투쟁과 삼보일배 등을 이어오며 윤석열... ◀ SYNC ▶ &quot;파면하라 파면하라 파면하라!&quot; 국민주권전국회의 광주전남본부 약 30명은 <b>4월</b> 4일은 헌법과 국민이... ","Wed, 02 Apr 2025 08:28:00 +0900"
"[기상청, 전국 지역별 오늘의 <b>날씨</b> 및 주간`주말<b>날씨</b>]전국 대기 매우 건...",http://www.economytalk.kr/news/articleView.html?idxno=405337,http://www.economytalk.kr/news/articleView.html?idxno=405337,"울산 +주요지역별 <b>날씨</b>전망(<b>4월</b> 2일부터 <b>4월</b> 5일까지. 기상청 예보 전문) *서울-인천-경기 &lt;특보 현황&gt; ○ 건조주의보: 서울(전 지역), 경기도(고양, 파주, 연천, 포천, 동두천, 양주, 의정부, 남양주, 가평, 양평, 여주... ","Wed, 02 Apr 2025 08:22:00 +0900"
서산시 발전을 위한 기관단체들 활발한 활동 추진,https://www.joongdo.co.kr/web/view.php?key=20250402010000511,https://www.joongdo.co.kr/web/view.php?key=20250402010000511,"92㎞ 대상, 덧씌우기 및 재포설 진행 충남 지방도 649호선 인지-부석 구간의 노면 보수공사가 <b>4월</b>부터 본격... 건조한 <b>날씨</b> 속에서 시민의 안전을 지키기 위해 긴장의 끈을 놓지 않고 있다. 최장일 서산소방서장은 &quot;시민의... ","Wed, 02 Apr 2025 08:20:00 +0900"
"호텔스컴바인, 스페인관광청·티웨이항공과 스페인 여행지 캠페인",https://www.slist.kr/news/articleView.html?idxno=631853,https://www.slist.kr/news/articleView.html?idxno=631853,"마요르카는 연중 온화한 <b>날씨</b>와 에메랄드빛 해변이 매력적인 대표 휴양지로, 다양한 해변 명소와 한적한... 구매 기간은 2025년 <b>4월</b> 14일까지이며, 탑승 기간은 2025년 10월 25일까지다. '스페인 항공권 단독 특가 소문내기... ","Wed, 02 Apr 2025 08:16:00 +0900"
"호텔스컴바인, 스페인관광청·티웨이항공과 손잡고 스페인 여행 캠페인...",https://www.pinpointnews.co.kr/news/articleView.html?idxno=333241,https://www.pinpointnews.co.kr/news/articleView.html?idxno=333241,"온화한 <b>날씨</b>로 대표되는 휴양지로 소개된다. 이번 캠페인에서는 실질적인 여행 혜택도 함께 제공된다.... 구매는 <b>4월</b> 14일까지, 탑승은 10월 25일까지 가능하다. 고객 참여형 이벤트도 마련됐다. 호텔스컴바인... ","Wed, 02 Apr 2025 08:08:00 +0900"
"린클, <b>4월</b> 2일 네이버 쇼핑라이브서 ‘린클 브랜드데이’ 진행",https://www.siminilbo.co.kr/news/newsview.php?ncode=1160272770134033,https://www.siminilbo.co.kr/news/newsview.php?ncode=1160272770134033,미생물 음식물처리기 1등 브랜드 린클이 <b>4월</b> 2일 오전 10시 30분부터 네이버 쇼핑라이브를 통해 ‘브랜드데이... 브랜드 관계자는 “<b>날씨</b>가 점점 따뜻해지면서 음식물 처리가 어려워지는 시기에 린클 제품이 많은... ,"Wed, 02 Apr 2025 08:00:00 +0900"
"광주 시민단체들, 헌법재판소에 윤석열 대통령 탄핵 촉구",https://kjmbc.co.kr/NewsArticle/1456280,https://kjmbc.co.kr/NewsArticle/1456280,"그간 광주 시민들은 영하의 <b>날씨</b>를 뚫고 광장에 모이는가 하면, 단식 투쟁과 삼보일배 등을 이어오며 윤석열... &quot;파면하라 파면하라 파면하라!&quot; 국민주권전국회의 광주전남본부 약 30명은 <b>4월</b> 4일은 헌법과 국민이... ","Wed, 02 Apr 2025 07:45:00 +0900"
"[<b>날씨</b>] 강원도, 화창한 아침 후 차차 흐려져…강원 전역에 5~10mm의 비,미...",https://www.cbci.co.kr/news/articleView.html?idxno=493975,https://www.cbci.co.kr/news/articleView.html?idxno=493975,"강원도는 <b>4월</b> 2일 수요일, 맑은 <b>날씨</b>로 시작해 점차 흐려질 전망이다.  [촬영 양지웅]  강원도는 <b>4월</b> 2일 수요일, 맑은 <b>날씨</b>로 시작해 점차 흐려질 전망이다. 기상청에 따르면 이날 오전 6시 기준, 주요 지역의 기온은... ","Wed, 02 Apr 2025 07:38:00 +0900"
"뉴워커, 다양한 러닝대회 및 걷기대회 '긱' 모집",https://www.slist.kr/news/articleView.html?idxno=631831,https://www.slist.kr/news/articleView.html?idxno=631831,특히 러닝의 계절인 따뜻해진 봄 <b>날씨</b>를 맞아 긱워커들 사이에도 러닝 대회 긱의 인기가 높아지고 있다.... 해당 긱은 <b>4월</b> 4일부터 5일까지 평택시 이충레포츠공원 일대에서 진행한다. 4일은 행사장 세팅과 사전 교육을... ,"Wed, 02 Apr 2025 07:32:00 +0900"
"군위군, 산림예방 전 산림지역 입산금지 긴급 행정명령",http://www.enewstoday.co.kr/news/articleView.html?idxno=2258177,http://www.enewstoday.co.kr/news/articleView.html?idxno=2258177,"군위군은 산림지역 출입금지 및 화기사용 전면금지를 내용으로 한 긴급 행정명령을 <b>4월</b>1일자로 발령했다.... 김진열 군수는 &quot;산불 예방은 모든 주민과 관련 기관의 협력과 노력에 달려 있다&quot;며, &quot;최근 건조한 <b>날씨</b>가... ","Wed, 02 Apr 2025 07:10:00 +0900"
2025 벚꽃 만개시기는?,https://www.etoday.co.kr/news/view/2458121,https://www.etoday.co.kr/news/view/2458121,"봄<b>날씨</b>가 이어지며 전국에 2025 벚꽃시즌에 대한 기대감이 커지고 있다. 산림청과 국립수목원, 국립산림과학원 등에서 예측한 자료에 따르면 올해 벚꽃은 3월 말 제주도를 시작으로 <b>4월</b> 초부터 중부 지역을 거쳐 강원... ","Wed, 02 Apr 2025 06:56:00 +0900"
NIE 논술 - 식목일이 나무 심는 날로 너무 늦다고요?,https://www.kidshankook.kr/news/articleView.html?idxno=13338,https://www.kidshankook.kr/news/articleView.html?idxno=13338,"나무를 심기에는 따뜻한 <b>날씨</b>보다는 약간은 쌀쌀한 <b>날씨</b>가 더 좋다는 말이 사실일까요? 나무 심기에 적당한 기온은 몇 도일까요? 구리구리 기자, 바로 취재해 보겠습니다. 출동! 왜 식목일을 <b>4월</b> 5일로 정했을까요?... ","Wed, 02 Apr 2025 06:52:00 +0900"
나무 한 그루가 성인 4명이 하루 숨 쉴 산소를 만든다고?,https://www.kidshankook.kr/news/articleView.html?idxno=13345,https://www.kidshankook.kr/news/articleView.html?idxno=13345,그런데 <b>날씨</b>가 더워지면서 식목일을 3월로 앞당겨야 한다는 이야기도 나오고 있다. 나무 한 그루의 가치... <b>4월</b> 마지막 금요일이다. 중국은 3월 12일이 '식목절'. 일본은 '식수제'와 '녹색의 날'을 <b>4월</b> 4일과 5일로 지정해... ,"Wed, 02 Apr 2025 06:52:00 +0900"
"[기상청, 오늘의 <b>날씨</b> 및 주간`주말<b>날씨</b>]전국 대기 매우 건조 산불 유의...",http://www.economytalk.kr/news/articleView.html?idxno=405334,http://www.economytalk.kr/news/articleView.html?idxno=405334,"중기 <b>날씨</b> 전망(<b>4월</b> 5일부터 <b>4월</b> 11일까지)5일 중부지방과 전북, 경북권 비! &lt; 중점 사항 &gt; ○ (강수) 5일(토)은 중부지방과 전북, 경북권에 비가 오겠다. 이번 예보기간 아침 기온은 2~13도, 낮 기온은 11~24도로 평년... ","Wed, 02 Apr 2025 06:36:00 +0900"
"우희진, 20대라 해도 믿을 동안美! 세월 무색한 청초 미모와 순수 데일...",https://www.mk.co.kr/article/11280041,https://m.entertain.naver.com/article/410/0001059216,"1일, 우희진은 인스타그램을 통해 “<b>4월</b> 봄인데 변덕스러운 <b>날씨</b>에 생뚱맞은 눈까지… 꽃샘추위 가고 곧 진짜 봄이 올 테니 모두 건강하게 지내자”는 글과 함께 여러 장의 사진을 게재했다. 그녀의 글만큼 따뜻하고 맑은... ","Wed, 02 Apr 2025 06:35:00 +0900"
[건강플러스] 봄철 운동 후 발생할 수 있는 정형외과 질환 및 치료법,https://www.imaeil.com/page/view/2025040110084128152,https://n.news.naver.com/mnews/article/088/0000939545?sid=103,"<b>날씨</b>가 제법 따뜻해지면서 봄을 실감하는 사람들이 많다. <b>4월</b>이 됐으니 이런저런 야외활동을 시작하는 사람들이 많은데, 문제는 겨울 동안 움츠러져 있던 몸을 움직여야 하니 굳어있던 관절, 근육에 무리가 올 수 있다는... ","Wed, 02 Apr 2025 06:30:00 +0900"
"우표로 만나는, ‘벚꽃 스폿’ 보문관광단지[우정 이야기]",https://weekly.khan.co.kr/khnm.html?mode=view&code=114&artid=202504020600051,https://n.news.naver.com/mnews/article/033/0000048581?sid=101,"어느새 따뜻해진 <b>날씨</b>에 ‘패딩의 계절’이 끝나고, 봄을 찾아 떠나는 상춘객의 발걸음도 빨라지고 있다.... 벚꽃 시즌을 맞아 우정사업본부도 <b>4월</b> 4일 보문관광단지의 풍경을 담은 기념우표 48만장을 발행한다. 경주... ","Wed, 02 Apr 2025 06:05:00 +0900"
&quot;이게 무슨 난리야&quot; 35곳 동시 산불 '초유의 사태'…또 담배꽁초 '휙'[뉴...,http://news.mt.co.kr/mtview.php?no=2025033112253433251,https://n.news.naver.com/mnews/article/008/0005174398?sid=102,"2023년 <b>4월</b> 2일 전국에 35건의 산불이 '동시다발적'으로 발생했다. 건조한 <b>날씨</b> 탓에 이튿날까지 전국 곳곳에서 산불이 발생했고 서울과 충남 홍성, 당진을 비롯해 전남 함평, 순천 주민들이 피해를 입었다. 피해 면적은... ","Wed, 02 Apr 2025 06:00:00 +0900"
이제 <b>4월</b>인데 이른 더위에 아이스크림 대전 '후끈',http://news.mt.co.kr/mtview.php?no=2025040116173513863,https://n.news.naver.com/mnews/article/008/0005174392?sid=101,<b>4월</b>부터 11월까지 여름 <b>날씨</b>가 이어질 것이란 전망이 나오고 3월 최고 기온도 신기록이 나온 가운데 신제품을 앞세워 시장 선점에 속도를 내고 있다. 2일 관련업계에 따르면 국내 빙과시장에서 빙그레와 롯데웰푸드가... ,"Wed, 02 Apr 2025 05:50:00 +0900"
역대 대형 산불 44% 집중… <b>4월</b>이 더 위험하다,https://www.seoul.co.kr/news/society/2025/04/02/20250402012004?wlog_tag3=naver,https://n.news.naver.com/mnews/article/081/0003529970?sid=102,건조한 <b>날씨</b>와 함께 양양군과 강릉시 사이에서 강한 바람이 불고 산불에 약한 소나무를 중심으로 숲이 구성돼 대형 산불로 확산되기 쉬운 조건을 갖추고 있다. 산림청 관계자는 “<b>4월</b>은 대기가 건조하고 산림에 탈 수... ,"Wed, 02 Apr 2025 05:02:00 +0900"
[기상속보]오늘<b>날씨</b> 큰 일교차 주의 서울 낮 16도 전국 5mm 비 미세먼지...,http://www.issuenbiz.com/news/articleView.html?idxno=58325,http://www.issuenbiz.com/news/articleView.html?idxno=58325,오늘<b>날씨</b> 큰 일교차 주의 서울 낮 16도 전국 5mm 비 미세먼지 나쁨...주말·주간 예보/사진=MBC영상 캡처... ◆다음은 기상청 발표 오는 <b>4월</b>5일부터 <b>4월</b>11일까지 주말및 주간 기상예보 내용이다. &lt; 중점 사항 &gt; ○ (강수) 5일... ,"Wed, 02 Apr 2025 05:00:00 +0900"
"'사별' 송선미, &quot;딸이 만들어준 하나밖에 없는 GD 응원봉&quot;",https://mydaily.co.kr/page/view/2025040111304309771,https://m.entertain.naver.com/article/117/0003928280,"패딩으로 무장할 만큼 추운 <b>날씨</b>에도 미소를 잃지 않아 지드래곤에 대한 팬심을 드러냈다. 송선미의 공연... 한편, 연극 ‘분홍립스틱’은 오는 <b>4월</b> 4일부터 5월 11일까지 KT&amp;G 상상마당 대치아트홀에서 공연된다.","Wed, 02 Apr 2025 02:30:00 +0900"
[살며 사랑하며] 청명이 온다,https://www.kmib.co.kr/article/view.asp?arcid=1743469512&code=11171315&cp=nv,https://n.news.naver.com/mnews/article/005/0001767028?sid=110,"하늘이 차츰 맑아진다는 뜻의 청명은 24절기 중 다섯 번째 절기로 음력 3월, 양력 <b>4월</b> 4~6일 무렵에 든다. 벌써... 청명에 <b>날씨</b>가 좋으면 그해 풍년이 들고 좋지 않으면 흉년이 든다고 점쳤으며, 산소를 돌보거나 이장을 해도... ","Wed, 02 Apr 2025 00:37:00 +0900"
[오늘의 <b>날씨</b>] 2025년 <b>4월</b> 2일,https://www.chosun.com/national/national_general/2025/04/02/TYJBXSWRNNEIFG2C5UQHSMLGDI/?utm_source=naver&utm_medium=referral&utm_campaign=naver-news,https://n.news.naver.com/mnews/article/023/0003896993?sid=102,전국 대체로 맑다가 차차 흐려져 낮부터 약한 비 2025년 <b>4월</b> 2일,"Wed, 02 Apr 2025 00:31:00 +0900"
벚꽃 터널 아래 펼쳐지는 봄날의 힙한 페스티벌,https://www.newscj.com/news/articleView.html?idxno=3252822,https://www.newscj.com/news/articleView.html?idxno=3252822,"주말 동안의 <b>날씨</b>도 축제를 즐기기에 괜찮은 수준이다. 기상청 예보에 따르면 <b>4월</b> 5일(토)은 오전에 간헐적 소나기가 예상되나, 오후에는 대체로 흐릴 예정이며 최고 기온은 12℃, 최저는 5℃다. 6일(일)은 더 맑고 따뜻해질... ","Wed, 02 Apr 2025 00:26:00 +0900"
[오늘의 <b>날씨</b>] <b>4월</b> 2일,https://www.joongang.co.kr/article/25325409,https://n.news.naver.com/mnews/article/025/0003431243?sid=103,,"Wed, 02 Apr 2025 00:26:00 +0900"
"기상청, 수도권·충청 '10mm 봄비' 주간<b>날씨</b>예보",https://www.gukjenews.com/news/articleView.html?idxno=3239405,https://www.gukjenews.com/news/articleView.html?idxno=3239405,"2일 <b>날씨</b>예보 (사진=기상청 제공) [<b>4월</b> 4일(금)] - 고기압의 영향으로 전국이 대체로 맑다가 오후부터 중부지방과 전라권은 구름많아지겠다. - 아침 기온은 1~7도, 낮 기온은 13~18도가 되겠다. [주말전망 5일(토) ~ 6일(일)... ","Wed, 02 Apr 2025 00:06:00 +0900"
[나는 청년 농부다] &quot;하트모양 곤달비는 내 운명&quot; 진부령에서 영근 농부...,http://www.kado.net/news/articleView.html?idxno=1302450,https://n.news.naver.com/mnews/article/654/0000113878?sid=102,닷새 후인 23일 강원 주요 지역은 20도를 훌쩍 넘기며 역대 두 번째로 더운 3월 <b>날씨</b>를 보였다. 하지만 24일... 흘리 곤달비는 대대리 지역 곤달비 출하가 끝난 <b>4월</b> 초중순부터 시작된다. 이른 봄 출하된 대대리 곤달비는... ,"Wed, 02 Apr 2025 00:06:00 +0900"
[오늘의 운세] 별자리별 운세-<b>4월</b> 2일,https://www.ajunews.com/view/20250401095826629,https://www.ajunews.com/view/20250401095826629,[별자리별 오늘의 운세] 양자리 (3월 21일~<b>4월</b> 19일) 행운이 따르는 날이기도 하지만 스트레스도 만만치 않은... [별자리별 오늘의 운세] 처녀자리 (8월 23일~9월 23일) <b>날씨</b>와는 상관없이 갑자기 춘곤증이 도진 것만 같습니다.... ,"Wed, 02 Apr 2025 00:02:00 +0900"
<b>4월</b> 1일 모닝뉴스 헤드라인,https://www.radiokorea.com/news/article.php?uid=469464,https://www.radiokorea.com/news/article.php?uid=469464,"한국 헌법재판소가 윤석열 대통령의 파면이냐, 직무복귀냐의 여부를 오는 <b>4월</b> 4일 오전 11시, LA시간으로... UCLA 와의 4강전이 무산됐다. 대학여자 농구 최고 주포인 주주 왓킨스의 부상으로 인한 공백이 컸다. 16. <b>날씨</b>","Wed, 02 Apr 2025 00:00:00 +0900"
"[보이는 것보다 가까이 있음] 오늘도 달린다, 미래를 구하는 과거가 되...",http://www.bulkwang.co.kr/news/articleView.html?idxno=39339,http://www.bulkwang.co.kr/news/articleView.html?idxno=39339,"기후 변화라고 하면 막연히 <b>날씨</b>가 따듯해지는 것, 여름이 길어지는 정도로 생각하는 경향이 있는데 사실은... 그는 <b>4월</b>에 눈을 보았던 곡성에서의 충격, 꼴딱꼴딱 넘어가는 숨을 붙잡고 있는 생명을 목격한... ","Wed, 02 Apr 2025 00:00:00 +0900"
[브리프]아모레퍼시픽 LF 라네즈 엘지유니참 뉴발란스,http://www.biztribune.co.kr/news/articleView.html?idxno=331996,http://www.biztribune.co.kr/news/articleView.html?idxno=331996,오는 <b>4월</b> 22일까지 모집하는 '아모레퍼시픽 뉴뷰티 이노베이션 챌린지' 대상 분야는 △뷰티 브랜드(스킨케어... 여름 <b>날씨</b>에도 소중한 아기 피부를 보송보송하게 유지할 수 있는 마미포코 썸머팬티로 차별적인... ,"Tue, 01 Apr 2025 23:36:00 +0900"
"광주소방, 청명·한식 대비 산불 예방 총력… '특별경계근무' 시작",https://www.geconomy.co.kr/news/article.html?no=296698,https://www.geconomy.co.kr/news/article.html?no=296698,"청명(<b>4월</b> 4일)과 한식(<b>4월</b> 5일) 기간 동안 성묘객과 상춘객으로 인한 산불 및 화재 위험이 높아질 것으로... 특히, 소방본부는 최근 건조한 <b>날씨</b>로 인해 산림화재의 위험이 커진 상황에서, 산불 예방을 위한 다양한 대책을... ","Tue, 01 Apr 2025 23:28:00 +0900"
[음ㆍ주 브리프] 하이트진로ㆍ코카콜라ㆍ디아지오코리아,https://www.dnews.co.kr/uhtml/view.jsp?idxno=202504011329060730597,https://www.dnews.co.kr/uhtml/view.jsp?idxno=202504011329060730597,"시작, <b>4월</b> 중순부터 대학가 상권 및 일반 업소에서 만나볼 수 있다. 하이트진로는 주요 상권에서 핵아이셔... 더워지는 <b>날씨</b>에도 부담 없이 즐기기 좋은 선택이 될 것”이라며 “앞으로도 소비자들의 선택권을 넓히기... ","Tue, 01 Apr 2025 23:20:00 +0900"
[데스크가 만난 사람]“의성 산청 산불 위험도 평년의 4배… 기후변화로...,https://www.donga.com/news/Opinion/article/all/20250401/131330040/2,https://n.news.naver.com/mnews/article/020/0003625273?sid=110,"또 “기후변화로 한반도 전역이 대규모 산불이 발생하기 쉬운 여건이 됐다”며 “이제 3, <b>4월</b> 산불이... 눈이 적게 쌓인 상황에서 <b>날씨</b>가 풀리면 녹은 눈이 증발하며 땅이 금세 건조해진다. 땅만 마르는 게 아니라 산불 발생... ","Tue, 01 Apr 2025 23:13:00 +0900"
"구례군, 2025 문화가 있는 날 구석구석 문화배달 '섬진강 문화레저파크...",http://www.lawissue.co.kr/view.php?ud=202504011528182449edd30pn2gj_12,http://www.lawissue.co.kr/view.php?ud=202504011528182449edd30pn2gj_12,"이날 구례에는 강한 바람과 쌀쌀한 <b>날씨</b>가 이어졌음에도 불구하고, 생활레저 숲 놀이터를 찾은 가족들의... 수요일(<b>4월</b> 30일, 5월 28일, 6월 25일, 7월 30일, 8월 27일, 9월 24일, 10월 29일)에 매천도서관에서 진행되는... ","Tue, 01 Apr 2025 21:40:00 +0900"
<b>4월</b> 첫날 거창·진주·고성서 산불 잇따라,http://www.knnews.co.kr/news/articleView.php?idxno=1457215,http://www.knnews.co.kr/news/articleView.php?idxno=1457215,"건조한 <b>날씨</b>가 이어지면서 <b>4월</b> 들어서도 거창과 진주, 고성에서 잇따라 산불이 발생했다. 1일 오후 2시 28분께 거창군 북상면 갈계리 산 22 야산에서 연기가 난다는 신고가 접수됐다. 산불이 5부 능선에서 발생해 차량... ","Tue, 01 Apr 2025 21:40:00 +0900"
